発表順,所属,学年,作品名,使用ソフト,紹介
1,勝山クラブ,6,獣害撃退用恐竜ロボット,IchigoJam,巨大恐竜型対クマ型ロボット。センサーで動体を検知したら録音した恐竜の音を大音量で再生し目が点滅する。迫力がすごい。すでに実戦配備、撃退実績あるところがすごい！
2,成器南小,6,クマダス,JavaScript,クマの出没情報を登録し地図で知らせるPC用webアプリ。被害の有無がアイコンで分かりやすい。1週間以上経過したものは薄く表示されクマの動きを掴める。傾向を自動分析してクマ予想もできるか！？
3,森田小,6,フクイザウルスを救え！,IchigoJam,恐竜博物館で設置し訪れる観光客を楽しませる、フクイザウルスを操作し、迫りくる壁（隕石落下による爆風）からすばやく逃げるゲーム。観光地毎にプログラミング友達に呼びかける。こども主催コンテストいいね！
4,惜陰小,6,自転車安全レーザー,IchigoJam,注意したい下り坂に設置する、近づいてくる自転車運転手にレーザー光で注意を促す装置の模型。ストローの両端にLEDを刺した表現がステキ。
5,スピリッツ・スマイル,4,事件お知らせロボ,Studuino,過去の人質事件から着想した、救助を求める声に反応し事故を知らせる自律走行ロボット。犯人に気づかれないよう移動して知らせてくれると便利かも。
6,スピリッツ・スマイル,6,コロナウイルスを撃退せよ！,Scratch,コロナウイルスを注射器で打って撃退するゲーム。ステージごとに様々な国が背景になる。難易度をコロナウイルスの状況オープンデータを使うとおもしろそう。
7,社南小,5,シューティング ダイナソー,Scratch,恐竜同士のシューティングゲーム。福井といえば恐竜！撃つほどにだんだん小さくなり難易度アップ。フクイラプトルなど恐竜毎の特徴が出ると楽しく学べるかも。
8,社南小,6,fukui（ふくい）すてきなところをごしょーかい！,Scratch,福井県内の観光地を地図から案内、写真と作者コメントで紹介するアプリ。リボンが付いたオリジナルのピンがかわいい！